{
  "schema_version": "2.0.0",
  "plan_id": "audioplan:fixture-mixed",
  "video_plan_ref": "video-plan:narrated-mixed",
  "script_ref": "narration-script:fixture-mixed",
  "source_evidence_ref": "source-evidence:narrated-mixed",
  "goal": "Explain the supplied source material clearly.",
  "audience": "general-reader",
  "canonical_script_check": {
    "phase": "pre_tts",
    "performed": true,
    "outcome": "pass",
    "evidence_ref": "fixture://script-check/mixed"
  },
  "segments": [
    {
      "segment_id": "seg-1",
      "beat_id": "beat-1",
      "scene_id": "scene-1",
      "spoken_text": "This source describes the starting point.",
      "narration_span_hash": "cccccccccccccccccccccccccccccccccccccccccccccccccccccccccccccccc",
      "target_duration_seconds": 15,
      "pause_after_ms": 250,
      "emphasis": []
    },
    {
      "segment_id": "seg-2",
      "beat_id": "beat-2",
      "scene_id": "scene-2",
      "spoken_text": "The supplied material explains the mechanism.",
      "narration_span_hash": "cccccccccccccccccccccccccccccccccccccccccccccccccccccccccccccccc",
      "target_duration_seconds": 15,
      "pause_after_ms": 0,
      "emphasis": []
    },
    {
      "segment_id": "seg-3",
      "beat_id": "beat-3",
      "scene_id": "scene-3",
      "spoken_text": "The source states the supported conclusion.",
      "narration_span_hash": "cccccccccccccccccccccccccccccccccccccccccccccccccccccccccccccccc",
      "target_duration_seconds": 15,
      "pause_after_ms": 0,
      "emphasis": []
    }
  ],
  "pronunciation_glossary": [
    {
      "term": "AES",
      "surface_text": "AES",
      "spoken_form": "A E S",
      "source_ref": "source-1"
    }
  ],
  "protected_values": [
    {
      "kind": "number",
      "exact_text": "45 seconds",
      "source_ref": "source-1",
      "locked": true
    }
  ],
  "delivery_intent": {
    "voice": "single narrator",
    "tone": "measured and clear",
    "pace": "unhurried",
    "pause_policy": "pause at completed semantic beats",
    "emphasis": [
      "supported conclusion"
    ]
  },
  "measurement": {
    "provider_status": "configured",
    "measured_audio_duration_seconds": 45,
    "measured_at": "2026-10-16T00:00:00Z",
    "evidence_ref": "fixture://audio-measurement/mixed"
  },
  "reconciliation": {
    "phase": "post_measurement",
    "action": "adjust_scene_timing",
    "affected_scene_ids": [
      "scene-3"
    ],
    "evidence_ref": "fixture://timing-reconcile/mixed"
  },
  "captions": {
    "enabled": true,
    "max_lines": 2,
    "safe_zone": "caption-safe",
    "alignment_status": "pass",
    "segments": [
      {
        "scene_id": "scene-1",
        "start_seconds": 0,
        "end_seconds": 15,
        "exact_text": "This caption changes the spoken words.",
        "lines": [
          "This caption changes the spoken words."
        ],
        "protected_exact_words": [],
        "measured_start_seconds": 0,
        "measured_end_seconds": 15,
        "alignment_evidence_ref": "fixture://caption-alignment/deny-1"
      },
      {
        "scene_id": "scene-2",
        "start_seconds": 15,
        "end_seconds": 30,
        "exact_text": "The supplied material explains the mechanism.",
        "lines": [
          "The supplied material explains the mechanism."
        ],
        "protected_exact_words": [],
        "measured_start_seconds": 15,
        "measured_end_seconds": 30,
        "alignment_evidence_ref": "fixture://caption-alignment/deny-2"
      },
      {
        "scene_id": "scene-3",
        "start_seconds": 30,
        "end_seconds": 45,
        "exact_text": "The source states the supported conclusion.",
        "lines": [
          "The source states the supported conclusion."
        ],
        "protected_exact_words": [
          "conclusion"
        ],
        "measured_start_seconds": 30,
        "measured_end_seconds": 45,
        "alignment_evidence_ref": "fixture://caption-alignment/deny-3"
      }
    ]
  },
  "status": "rendered"
}
